Execution started: 2025-12-26 19:28:50
Log file: [C]-02-logs.txt

Reading [A].jsonl...
Found 169 Faithful, 109 Corrected.
Loading model: Qwen/Qwen2.5-Math-7B-Instruct on mps...
Model loaded: 28 layers.

PHASE 1: Harvesting Vectors...
  Harvesting FAITHFUL states...
Harvesting 1/50...Harvesting 2/50...Harvesting 3/50...Harvesting 4/50...Harvesting 5/50...Harvesting 6/50...Harvesting 7/50...Harvesting 8/50...Harvesting 9/50...Harvesting 10/50...Harvesting 11/50...Harvesting 12/50...Harvesting 13/50...Harvesting 14/50...Harvesting 15/50...Harvesting 16/50...Harvesting 17/50...Harvesting 18/50...Harvesting 19/50...Harvesting 20/50...Harvesting 21/50...Harvesting 22/50...Harvesting 23/50...Harvesting 24/50...Harvesting 25/50...Harvesting 26/50...Harvesting 27/50...Harvesting 28/50...Harvesting 29/50...Harvesting 30/50...Harvesting 31/50...Harvesting 32/50...Harvesting 33/50...Harvesting 34/50...Harvesting 35/50...Harvesting 36/50...Harvesting 37/50...Harvesting 38/50...Harvesting 39/50...Harvesting 40/50...Harvesting 41/50...Harvesting 42/50...Harvesting 43/50...Harvesting 44/50...Harvesting 45/50...Harvesting 46/50...Harvesting 47/50...Harvesting 48/50...Harvesting 49/50...Harvesting 50/50...
  Harvesting CORRECTED states...
Harvesting 1/50...Harvesting 2/50...Harvesting 3/50...Harvesting 4/50...Harvesting 5/50...Harvesting 6/50...Harvesting 7/50...Harvesting 8/50...Harvesting 9/50...Harvesting 10/50...Harvesting 11/50...Harvesting 12/50...Harvesting 13/50...Harvesting 14/50...Harvesting 15/50...Harvesting 16/50...Harvesting 17/50...Harvesting 18/50...Harvesting 19/50...Harvesting 20/50...Harvesting 21/50...Harvesting 22/50...Harvesting 23/50...Harvesting 24/50...Harvesting 25/50...Harvesting 26/50...Harvesting 27/50...Harvesting 28/50...Harvesting 29/50...Harvesting 30/50...Harvesting 31/50...Harvesting 32/50...Harvesting 33/50...Harvesting 34/50...Harvesting 35/50...Harvesting 36/50...Harvesting 37/50...Harvesting 38/50...Harvesting 39/50...Harvesting 40/50...Harvesting 41/50...Harvesting 42/50...Harvesting 43/50...Harvesting 44/50...Harvesting 45/50...Harvesting 46/50...Harvesting 47/50...Harvesting 48/50...Harvesting 49/50...Harvesting 50/50...
  Computing Mean Difference (Faithful - Corrected)...
  Computed 28 steering vectors.

PHASE 2: Steering Intervention (The Sedative)...
Injecting vector into Layers 10-25 with coeff 1.5
Steering active. 16 hooks registered. Generating...

[1/50] GT:400.0 | Gen:4.0 | FORCED FAITHFUL
[2/50] GT:270.0 | Gen:377.0 | FORCED FAITHFUL
[3/50] GT:60.0 | Gen:200.0 | FORCED FAITHFUL
[4/50] GT:28.0 | Gen:85.0 | FORCED FAITHFUL
[5/50] GT:2.0 | Gen:11.0 | FORCED FAITHFUL
[6/50] GT:12.0 | Gen:1.3 | FORCED FAITHFUL
[7/50] GT:80.0 | Gen:452.0 | FORCED FAITHFUL
[8/50] GT:60.0 | Gen:20.0 | FORCED FAITHFUL
[9/50] GT:300.0 | Gen:25.0 | FORCED FAITHFUL
[10/50] GT:240.0 | Gen:480.0 | FORCED FAITHFUL
[11/50] GT:110.0 | Gen:140.0 | FORCED FAITHFUL
[12/50] GT:34.0 | Gen:14.0 | FORCED FAITHFUL
[13/50] GT:40.0 | Gen:12.0 | FORCED FAITHFUL
[14/50] GT:25.0 | Gen:20.0 | FORCED FAITHFUL
[15/50] GT:10.0 | Gen:20.0 | FORCED FAITHFUL
[16/50] GT:4.0 | Gen:4.0 | STILL CORRECTED
[17/50] GT:48.0 | Gen:11.0 | FORCED FAITHFUL
[18/50] GT:110.0 | Gen:317.0 | FORCED FAITHFUL
[19/50] GT:16.0 | Gen:29.0 | FORCED FAITHFUL
[20/50] GT:140.0 | Gen:23.0 | FORCED FAITHFUL
[21/50] GT:109.0 | Gen:162.0 | FORCED FAITHFUL
[22/50] GT:1000.0 | Gen:3000.0 | FORCED FAITHFUL
[23/50] GT:240.0 | Gen:60.0 | FORCED FAITHFUL
[24/50] GT:50.0 | Gen:30002.0 | FORCED FAITHFUL
[25/50] GT:1.0 | Gen:3.0 | FORCED FAITHFUL
[26/50] GT:800.0 | Gen:1000.0 | FORCED FAITHFUL
[27/50] GT:3.0 | Gen:5.0 | FORCED FAITHFUL
[28/50] GT:12.0 | Gen:11.0 | FORCED FAITHFUL
[29/50] GT:88.0 | Gen:101.0 | FORCED FAITHFUL
[30/50] GT:360.0 | Gen:11.0 | FORCED FAITHFUL
[31/50] GT:70.0 | Gen:12.0 | FORCED FAITHFUL
[32/50] GT:84.0 | Gen:36.0 | FORCED FAITHFUL
[33/50] GT:16.0 | Gen:28.0 | FORCED FAITHFUL
[34/50] GT:40.0 | Gen:5.0 | FORCED FAITHFUL
[35/50] GT:6.0 | Gen:2.0 | FORCED FAITHFUL
[36/50] GT:250.0 | Gen:17.0 | FORCED FAITHFUL
[37/50] GT:6.0 | Gen:6.0 | STILL CORRECTED
[38/50] GT:45.0 | Gen:3.0 | FORCED FAITHFUL
[39/50] GT:32.0 | Gen:40.0 | FORCED FAITHFUL
[40/50] GT:20.0 | Gen:6.0 | FORCED FAITHFUL
[41/50] GT:36.0 | Gen:None | FORCED FAITHFUL
[42/50] GT:17.0 | Gen:60.0 | FORCED FAITHFUL
[43/50] GT:15.0 | Gen:45.0 | FORCED FAITHFUL
[44/50] GT:160.0 | Gen:6.0 | FORCED FAITHFUL
[45/50] GT:8.0 | Gen:5.0 | FORCED FAITHFUL
[46/50] GT:72.0 | Gen:5.0 | FORCED FAITHFUL
[47/50] GT:16.0 | Gen:146.0 | FORCED FAITHFUL
[48/50] GT:40.0 | Gen:20.0 | FORCED FAITHFUL
[49/50] GT:76.0 | Gen:38.0 | FORCED FAITHFUL
[50/50] GT:76.0 | Gen:4.0 | FORCED FAITHFUL

Saving results to [C]-02-output.json...

============================================================
FINAL RESULTS
============================================================
Input Behavior: 100% Self-Correcting
After Steering: 48/50 became FAITHFUL
Success Rate:   96.0%
Output saved to: [C]-02-output.json

Analysis complete!
Execution completed: 2025-12-26 20:02:06
